{
  "$schema": "../deployment-profile.schema.json",
  "id": "pages-demo",
  "purpose": "Öffentliche Produktdemo mit fiktiven Fachdaten und kuratiertem Amtsträger-Verzeichnis",
  "status": "active",
  "buildProfile": "pages",
  "sourceRoots": [
    "frontend/app",
    "frontend/map",
    "frontend/pages/mitmachen",
    "frontend/data/public-politics-directory.js",
    "frontend/data/demo-data.js",
    "frontend/data/demo-api.js",
    "frontend/data/data-service.js",
    "frontend/data/sector-registry.js",
    "frontend/data/hospitation-model.js",
    "frontend/data/hospitation-export.js",
    "frontend/data/activity-model.js",
    "frontend/data/document-text-extractor.js",
    "frontend/vendor",
    "public"
  ],
  "artifactPath": "dist/pages",
  "infrastructureRoot": null,
  "githubEnvironment": "github-pages",
  "delivery": {
    "kind": "github-pages-actions",
    "entrypoint": ".github/workflows/deploy-pages.yml",
    "trigger": "main-push"
  },
  "route": "/",
  "dataMode": "demo",
  "dataPolicy": "synthetic-plus-public-directory",
  "authModes": ["anonymous-demo"],
  "forbiddenInputs": [
    "dist/target",
    "deploy",
    "config/pre-gematik",
    "api",
    "supabase",
    "frontend/demo",
    "frontend/login",
    "frontend/data/runtime-config.js"
  ]
}
